{
  "queue_id": "test-queue-acp.json",
  "run_at": "2026-03-14T03:25:28.239Z",
  "passed": 1,
  "failed": 1,
  "skipped": 0,
  "tasks": [
    {
      "id": "T2.1",
      "status": "fail",
      "duration_ms": 8782,
      "reason": "output missing: session/new, session/prompt",
      "output": "ACP WebSocket 핸드셰이크 테스트 시작 — ws://localhost:3001\n타임아웃: 60000ms\n✅ WebSocket 연결 성공\n수신 [agent_ready]: {\"type\":\"agent_ready\"}\n✅ agent_ready 수신 — ACP 핸드셰이크 완료!\n\n✅ T2.1 통과 — 수신된 메시지 타입: agent_ready\n",
      "retries": 3
    },
    {
      "id": "T2.2",
      "status": "pass",
      "duration_ms": 197
    }
  ]
}