{
  "queue_id": "test-queue-sse.json",
  "run_at": "2026-03-14T04:00:59.475Z",
  "passed": 1,
  "failed": 1,
  "skipped": 0,
  "tasks": [
    {
      "id": "T3.1",
      "status": "pass",
      "duration_ms": 206
    },
    {
      "id": "T3.2",
      "status": "fail",
      "duration_ms": 148,
      "reason": "exit_code 1, expected 0; output missing: agent_ready, T3.2 통과",
      "output": "node:internal/modules/package_json_reader:314\n  throw new ERR_MODULE_NOT_FOUND(packageName, fileURLToPath(base), null);\n        ^\n\nError [ERR_MODULE_NOT_FOUND]: Cannot find package 'eventsource' imported from /home/leth2/.openclaw/workspace/test-all/test/sse-handshake.js\n    at Object.getPackageJSON",
      "retries": 3
    }
  ]
}